{
  "$schema": "./schemas/gates.schema.json",
  "kind": "autoprompt-check-registry",
  "contractVersion": "2.0.0",
  "outcomeSchema": "agents/contracts/schemas/outcome.schema.json",
  "definitions": {
    "success-definition": {
      "owner": "run-owner",
      "inputs": [
        "request-envelope",
        "route-decision"
      ],
      "outputs": [
        "success-checklist",
        "planned-checks"
      ],
      "sideEffects": [
        "run-record-write"
      ],
      "independent": false,
      "failureOwner": "run-owner",
      "retryPolicy": {
        "kind": "bounded-progress",
        "maxAttempts": 2,
        "retryableFailures": [
          "SCHEMA_INVALID"
        ],
        "requiresProgressAfterFailure": true,
        "progressFingerprintFields": [
          "inputHashes",
          "candidateVersionHash",
          "oracleEvidenceHash"
        ],
        "maxUnchangedFailures": 1,
        "onExhaustion": {
          "state": "FAILED",
          "outcomeCode": "FAILED"
        }
      },
      "execution": {
        "command": {
          "kind": "contract-operation",
          "name": "compile-success-definition",
          "argv": [
            "autoprompt-gate-runner",
            "--check",
            "success-definition"
          ],
          "workingDirectory": "declared-workspace",
          "timeoutSeconds": 300,
          "availability": "required-preflight",
          "requiredCapabilities": [
            "json-schema-validation",
            "effect-specific-acceptance"
          ]
        },
        "oracle": {
          "kind": "schema-and-effect-acceptance",
          "availability": "required-preflight",
          "requiredCapabilities": [
            "json-schema-validation",
            "effect-specific-acceptance",
            "evidence-capture"
          ],
          "successCondition": "Every declared output of success-definition exists, is bound to the frozen inputs, and satisfies its effect-specific acceptance."
        },
        "negativePaths": [
          {
            "id": "command-unavailable",
            "condition": "The command or a required capability is unavailable at preflight or execution time.",
            "expectedOutcome": "PROVIDER_UNSUPPORTED",
            "requiredEvidence": [
              "capability-attestation",
              "availability-probe"
            ]
          },
          {
            "id": "oracle-rejected",
            "condition": "The command returns but the observable check rejects an output or required negative-path check.",
            "expectedOutcome": "FAILED",
            "requiredEvidence": [
              "command-receipt",
              "oracle-result",
              "negative-path-result"
            ]
          }
        ]
      }
    },
    "short-plan": {
      "owner": "run-owner",
      "inputs": [
        "route-decision",
        "success-checklist"
      ],
      "outputs": [
        "light-plan"
      ],
      "sideEffects": [
        "run-record-write"
      ],
      "independent": false,
      "failureOwner": "run-owner",
      "retryPolicy": {
        "kind": "bounded-progress",
        "maxAttempts": 2,
        "retryableFailures": [
          "SCHEMA_INVALID"
        ],
        "requiresProgressAfterFailure": true,
        "progressFingerprintFields": [
          "inputHashes",
          "candidateVersionHash",
          "oracleEvidenceHash"
        ],
        "maxUnchangedFailures": 1,
        "onExhaustion": {
          "state": "FAILED",
          "outcomeCode": "FAILED"
        }
      },
      "execution": {
        "command": {
          "kind": "contract-operation",
          "name": "compile-light-plan",
          "argv": [
            "autoprompt-gate-runner",
            "--check",
            "short-plan"
          ],
          "workingDirectory": "declared-workspace",
          "timeoutSeconds": 300,
          "availability": "required-preflight",
          "requiredCapabilities": [
            "json-schema-validation",
            "dependency-analysis"
          ]
        },
        "oracle": {
          "kind": "schema-and-dependency",
          "availability": "required-preflight",
          "requiredCapabilities": [
            "json-schema-validation",
            "dependency-analysis",
            "evidence-capture"
          ],
          "successCondition": "Every declared output of short-plan exists, is bound to the frozen inputs, and satisfies its effect-specific acceptance."
        },
        "negativePaths": [
          {
            "id": "command-unavailable",
            "condition": "The command or a required capability is unavailable at preflight or execution time.",
            "expectedOutcome": "PROVIDER_UNSUPPORTED",
            "requiredEvidence": [
              "capability-attestation",
              "availability-probe"
            ]
          },
          {
            "id": "oracle-rejected",
            "condition": "The command returns but the observable check rejects an output or required negative-path check.",
            "expectedOutcome": "FAILED",
            "requiredEvidence": [
              "command-receipt",
              "oracle-result",
              "negative-path-result"
            ]
          }
        ]
      }
    },
    "roadmap-authoring": {
      "owner": "roadmap-author",
      "inputs": [
        "request-envelope",
        "route-decision",
        "named-scout-results"
      ],
      "outputs": [
        "ROADMAP.md"
      ],
      "sideEffects": [
        "plan-write"
      ],
      "independent": false,
      "failureOwner": "roadmap-author",
      "retryPolicy": {
        "kind": "bounded-progress",
        "maxAttempts": 3,
        "retryableFailures": [
          "SCHEMA_INVALID",
          "INPUT_FINGERPRINT_CHANGED",
          "EVIDENCE_FINGERPRINT_CHANGED"
        ],
        "requiresProgressAfterFailure": true,
        "progressFingerprintFields": [
          "inputHashes",
          "candidateVersionHash",
          "oracleEvidenceHash"
        ],
        "maxUnchangedFailures": 1,
        "onExhaustion": {
          "state": "FAILED",
          "outcomeCode": "FAILED"
        }
      },
      "execution": {
        "command": {
          "kind": "contract-operation",
          "name": "author-roadmap",
          "argv": [
            "autoprompt-gate-runner",
            "--check",
            "roadmap-authoring"
          ],
          "workingDirectory": "declared-workspace",
          "timeoutSeconds": 900,
          "availability": "required-preflight",
          "requiredCapabilities": [
            "roadmap-authoring",
            "dependency-analysis"
          ]
        },
        "oracle": {
          "kind": "roadmap-coverage-and-order",
          "availability": "required-preflight",
          "requiredCapabilities": [
            "roadmap-authoring",
            "dependency-analysis",
            "evidence-capture"
          ],
          "successCondition": "Every declared output of roadmap-authoring exists, is bound to the frozen inputs, and satisfies its effect-specific acceptance."
        },
        "negativePaths": [
          {
            "id": "command-unavailable",
            "condition": "The command or a required capability is unavailable at preflight or execution time.",
            "expectedOutcome": "PROVIDER_UNSUPPORTED",
            "requiredEvidence": [
              "capability-attestation",
              "availability-probe"
            ]
          },
          {
            "id": "oracle-rejected",
            "condition": "The command returns but the observable check rejects an output or required negative-path check.",
            "expectedOutcome": "FAILED",
            "requiredEvidence": [
              "command-receipt",
              "oracle-result",
              "negative-path-result"
            ]
          }
        ]
      }
    },
    "plan-check": {
      "owner": "plan-checker",
      "inputs": [
        "request-envelope",
        "route-decision",
        "ROADMAP.md"
      ],
      "outputs": [
        "plan-check-result"
      ],
      "sideEffects": [
        "result-return-only"
      ],
      "independent": true,
      "failureOwner": "roadmap-author",
      "retryPolicy": {
        "kind": "bounded-progress",
        "maxAttempts": 2,
        "retryableFailures": [
          "INPUT_FINGERPRINT_CHANGED",
          "TRANSIENT_TOOL_FAILURE"
        ],
        "requiresProgressAfterFailure": true,
        "progressFingerprintFields": [
          "inputHashes",
          "candidateVersionHash",
          "oracleEvidenceHash"
        ],
        "maxUnchangedFailures": 1,
        "onExhaustion": {
          "state": "BLOCKED",
          "outcomeCode": "BLOCKED"
        }
      },
      "execution": {
        "command": {
          "kind": "contract-operation",
          "name": "check-roadmap",
          "argv": [
            "autoprompt-gate-runner",
            "--check",
            "plan-check"
          ],
          "workingDirectory": "declared-workspace",
          "timeoutSeconds": 300,
          "availability": "required-preflight",
          "requiredCapabilities": [
            "independent-checking",
            "roadmap-validation"
          ]
        },
        "oracle": {
          "kind": "independent-roadmap-check",
          "availability": "required-preflight",
          "requiredCapabilities": [
            "independent-checking",
            "roadmap-validation",
            "evidence-capture"
          ],
          "successCondition": "Every declared output of plan-check exists, is bound to the frozen inputs, and satisfies its effect-specific acceptance."
        },
        "negativePaths": [
          {
            "id": "command-unavailable",
            "condition": "The command or a required capability is unavailable at preflight or execution time.",
            "expectedOutcome": "PROVIDER_UNSUPPORTED",
            "requiredEvidence": [